{
  "schema_version": 1,
  "goal_id": "alpha-only",
  "title": "Implement alpha",
  "status": "SEALED",
  "summary": "Three pure functions where gamma composes alpha and beta.",
  "objective": "Implement alpha so that its unit test passes.",
  "in_scope": [
    "lib/alpha.py"
  ],
  "out_of_scope": [
    "tests/**"
  ],
  "requirements": [
    {
      "id": "REQ-1",
      "statement": "All unit tests pass",
      "priority": "must"
    }
  ],
  "constraints": [],
  "success_metrics": [
    {
      "id": "MET-1",
      "metric": "Test suite",
      "target": "100% pass",
      "measurement": "python3 -m unittest discover"
    }
  ],
  "acceptance_criteria": [
    {
      "id": "ACC-1",
      "criterion": "python3 -m unittest discover -s tests passes",
      "verification_type": "automated"
    }
  ],
  "decisions": [],
  "research_questions": [],
  "open_questions": [],
  "routing": {
    "change_shape": "localized",
    "risk": "low",
    "existing_gate": true,
    "architecture_uncertainty": false,
    "external_research_required": false
  },
  "approval": {
    "approved_by": "user",
    "approved_at": "2026-09-08T00:00:00.000Z",
    "goal_digest": "720a61f82e4de7c4af4b5664ecfbda2c38e527c92042833443f1c53309db74f7",
    "via": "test fixture"
  }
}
